id,created_iso,subreddit,title,author,score,num_comments,link_flair_text,over_18,is_self
1nossbl,2025-09-23T20:41:36+00:00,fashion,Didn’t wanna do my hair so the top is the fit!,futuresextherapist,78,4,Outfit of The Day,False,False
1nop13h,2025-09-23T18:18:56+00:00,fashion,I'm unsure of this outfit..,Electronic_Job_9259,170,57,Advice Wanted Please! ,False,False
1noox3h,2025-09-23T18:14:44+00:00,fashion,Day 1 Conference Outfit,olchai_mp3,2094,129,Outfit of The Day,False,False
1nokhlb,2025-09-23T15:28:46+00:00,fashion,Vibes of the day,HifiAddicted,113,8,🚫NO Advice Wanted!!!🚫,False,False
1nojwcc,2025-09-23T15:06:40+00:00,fashion,"been busy with college, but here’s my outfit for classes :)",anotherrandomm1,224,10,Outfit of The Day,False,False
1nogfsa,2025-09-23T12:46:51+00:00,fashion,"New skirt and a couple new tops to wear out this weekend, the tops are faux wrap and wrap and have pretty bows in the back ✨️.",Important_Cod_8970,80,5,💕Positive Vibes ONLY💕,False,False
1nof7a1,2025-09-23T11:49:01+00:00,fashion,"Old woman still loving fashion and makeup, don’t let them put you in a box!",KateR_H0l1day,843,107,Label My Style ,False,False
1noe2we,2025-09-23T10:48:28+00:00,fashion,Almost never wear yellow but gave it a try on holiday 😊,xen__xen,197,55,Outfit of The Day,False,False
1nodayi,2025-09-23T10:02:36+00:00,fashion,Outfit from last evening.,funnyChic1201,174,11,Outfit of The Day,False,False
1no8lci,2025-09-23T05:00:08+00:00,fashion,I see ppl on here asking what their style is sometimes n was wondering what u guys would say mine is?,m00beep,62,36,Feedback Wanted! ,False,False
1no1wzq,2025-09-22T23:27:00+00:00,fashion,First day of Fall 💓🎸🍁,Ok_Mastodon_8706,186,21,Outfit of The Day,False,False
1nnxdpa,2025-09-22T20:18:58+00:00,fashion,"Just received this set, not sure im loving it. Keep or return?",olchai_mp3,926,356,Feedback Wanted! ,False,False
1nnv21u,2025-09-22T18:50:26+00:00,fashion,What do you think about this kind of dresses? Is it old-fashioned?,ExcellentApricot1913,50,48,Advice Wanted Please! ,False,False
1nnuv4l,2025-09-22T18:43:14+00:00,fashion,Just a casual fit for a dinner by the beach,asian_geeky,95,8,💕💕Positive Vibes Only💕💕,False,False
1nntctx,2025-09-22T17:48:03+00:00,fashion,in love with this sweater,starrypond,100,15,Outfit of The Day,False,False
1nnq9mv,2025-09-22T15:53:28+00:00,fashion,Dress despite weather today,HifiAddicted,316,27,Outfit of The Day,False,False
1nnnk4b,2025-09-22T14:11:36+00:00,fashion,thought it was fashionable,sodespicable,102,7,Feedback Wanted! ,False,False
1nnj5bv,2025-09-22T10:47:48+00:00,fashion,Outfit from going out for my Brothers Birthday,Maleficent-Jury5515,927,129,Outfit of The Day,False,False
1nnc4ku,2025-09-22T03:38:53+00:00,fashion,Should I wear a skirt or pants for tomorrow ?,BeautifulHat4050,88,81,⚠️HONEST⚠️Advice Wanted- I can Handle The Truth!!! ,False,False
1nn3ik5,2025-09-21T20:59:39+00:00,fashion,Is this dress too short for a first date?,NeonPurple-dreams,1619,480,Advice Wanted Please! ,False,False
1nn32vf,2025-09-21T20:42:23+00:00,fashion,laundry day,thelastpegasus,107,7,Outfit of The Day,False,False
1nn16dj,2025-09-21T19:28:23+00:00,fashion,A week of summer work outfits 🖤🕷️,midwest_monster,106,30,🕷️Spooky Season🕷️,False,False
1nn0e3p,2025-09-21T18:58:40+00:00,fashion,Outfits from the three seasons my area experienced in the past month and a half,batpig1990,687,80,Outfit of The Day,False,False
1nmpad2,2025-09-21T11:15:29+00:00,fashion,Colors for the autumn vibes !,HifiAddicted,134,9,Outfit of The Day,False,False
1nmkkqy,2025-09-21T06:23:44+00:00,fashion,Casual Saturday,Ok_Mastodon_8706,52,2,Outfit of The Day,False,False
1nmfhex,2025-09-21T01:40:46+00:00,fashion,can’t decide whether to keep this top,thelastpegasus,80,33,Outfit of The Day,False,False
1nme736,2025-09-21T00:35:10+00:00,fashion,"I've always loved the black gown that actress Eva Green wore in ""Casino Royale"" for her portrayal of the character Vesper Lynd, so this was my attempt to recreate the look.",smugmisswoodhouse,2943,81,Special Occasion Outfit,False,False
1nmdbu8,2025-09-20T23:52:35+00:00,fashion,OOTD just got this romper recently ✌🏻,starrypond,60,15,Outfit of The Day,False,False
1nmbitp,2025-09-20T22:29:35+00:00,fashion,One of my favorites for sure!!,Souhwhyarewehere-lol,306,31,Outfit of The Day,False,False
1nm6xj5,2025-09-20T19:17:06+00:00,fashion,Brunch with friends. Embracing last summer weekend,olchai_mp3,230,15,Outfit of The Day,False,False
1nm4c5z,2025-09-20T17:34:14+00:00,fashion,My first Ren Fest!,,374,21,Special Occasion Outfit,False,False
1nm2c0x,2025-09-20T16:15:11+00:00,fashion,Wore this sweater dress out yesterday!,the-nerdy-girl,113,34,Outfit of The Day,False,False
1nly06d,2025-09-20T13:20:01+00:00,fashion,With the suede or without it?,BioticBard,545,243,Advice Wanted Please! ,False,False
1nlr963,2025-09-20T06:53:20+00:00,fashion,Should I add the belt or lose the belt?,Duskymoonlight,499,410,Feedback Wanted! ,False,False
1nlqgm6,2025-09-20T06:05:30+00:00,fashion,Fit check ✅,Acceptable-Owl3920,107,10,Outfit of The Day,False,False
1nlnr79,2025-09-20T03:33:26+00:00,fashion,New to skirts. Helpe style this one,AnkuRani,166,102,Help me coordinate my outfit! ,False,False
1nlksi7,2025-09-20T01:02:10+00:00,fashion,outfit from a trip this summer,thelastpegasus,161,9,Outfit of The Day,False,False
1nlkibc,2025-09-20T00:48:23+00:00,fashion,Fun Vegas outfit ! When in Vegas ….,Miss_v_007,221,27,Special Occasion Outfit,False,False
1nla5h9,2025-09-19T17:39:22+00:00,fashion,burgundy for fall!,annerias,146,3,Outfit of The Day,False,False
1nl85m0,2025-09-19T16:24:09+00:00,fashion,Tried the Blazer that I thrifted recently,Samqureehi12,86,17,Feedback Wanted! ,False,False
1nl67bt,2025-09-19T15:11:14+00:00,fashion,Taking some of the constructive criticisms from my last post for today’s fit.,Great-Reflection5651,57,12,Feedback Wanted! ,False,False
1nl5tiz,2025-09-19T14:56:55+00:00,fashion,Outfit for the day I walked the Pamella Roland NYFW show. Still wearing the makeup post-show here. 😇,bbjeanofficial,165,20,Outfit of The Day,False,False
1nl5985,2025-09-19T14:35:00+00:00,fashion,Is it a good fit for a friendly dinner night out? Or too formal?,LowlyStole,559,162,Advice Wanted Please! ,False,False
1nl55xq,2025-09-19T14:31:30+00:00,fashion,Girls. Night. Out(fit),Blueberryvodka248,454,34,💕💕Positive Vibes Only💕💕,False,False
1nkz3yn,2025-09-19T09:40:59+00:00,fashion,Outfit for girls night out 🍷,kxfrac,1216,86,🚫NO Advice Wanted!!!🚫,False,False
1nkylha,2025-09-19T09:07:27+00:00,fashion,"Another day, another dress",justareallgirl,368,13,Outfit of The Day,False,False
1nkw7ow,2025-09-19T06:33:36+00:00,fashion,This was my outfit for my friend’s birthday.,funnyChic1201,571,48,Outfit of The Day,False,False
1nkutlv,2025-09-19T05:11:21+00:00,fashion,Thursday’s preppy look for work,olchai_mp3,143,6,Outfit of The Day,False,False
1nkqsbk,2025-09-19T01:48:40+00:00,fashion,rotted in bed all day but my fit to do some grocery shopping now :),EvaaRayne,56,3,Outfit of The Day,True,False
1nkqn06,2025-09-19T01:41:58+00:00,fashion,Day fit,Paranoid-Intuition1,135,6,Outfit of The Day,False,False
1nkjp44,2025-09-18T20:39:53+00:00,fashion,How do I look in green? 💚,Souhwhyarewehere-lol,78,31,Outfit of The Day,False,False
1nkhkxb,2025-09-18T19:19:13+00:00,fashion,A bit more casual today,WhiteMustang17,99,34,Outfit of The Day,False,False
1nkglcr,2025-09-18T18:41:38+00:00,fashion,100% thrifted birthday outfit,babyjapes,613,37,Special Occasion Outfit,False,False
1nkfrw9,2025-09-18T18:10:58+00:00,fashion,Are skinny jeans with boots still fashionable in 2025?,Ok-Simple2101,1098,537,Advice Wanted Please! ,False,False
1nkf5mb,2025-09-18T17:47:55+00:00,fashion,Tried this look today—yay or nay?,Elizabeth-500,770,305,Feedback Wanted! ,False,False
1nkebkd,2025-09-18T17:16:48+00:00,fashion,going out in this OOTD,AnyaCipher,105,9,Outfit of The Day,False,False
1nkdpez,2025-09-18T16:54:10+00:00,fashion,Blue denim dress as OOTD,HifiAddicted,78,8,Outfit of The Day,False,False
1nkblhv,2025-09-18T15:36:12+00:00,fashion,Which outfit should I wear to my college orientation day or the first day of college?,AmbitiousPanda6744,56,209,Special Occasion Outfit,False,False
1nk8sjc,2025-09-18T13:48:12+00:00,fashion,Lemurs and pockets!,CausingTrebleAlways,99,7,Outfit of The Day,False,False
1nk4lwd,2025-09-18T10:28:18+00:00,fashion,Not a pants girl… but here we are lol,IntrovertedLioness,141,34,🤩Showcase 🤩,False,False
1njy4id,2025-09-18T03:49:13+00:00,fashion,Spring colors Fall textures,Ok_Mastodon_8706,2211,206,Outfit of The Day,False,False
1njvozc,2025-09-18T01:48:05+00:00,fashion,black on black outfit today,EvaaRayne,207,10,Outfit of The Day,True,False
1njshf7,2025-09-17T23:18:16+00:00,fashion,Which way do you like better and why?,julesmacmarie,259,504,Feedback Wanted! ,False,False
1njrw88,2025-09-17T22:52:55+00:00,fashion,my final outfit decision for my date,starrypond,257,43,Outfit of The Day,False,False
1njoo27,2025-09-17T20:41:26+00:00,fashion,Strawberries!!! 🍓🍓🍓,Souhwhyarewehere-lol,276,20,Outfit of The Day,False,False
1njk0l0,2025-09-17T17:45:40+00:00,fashion,Brunch in the city OOTD,vilahoney,754,40,Outfit of The Day,False,False
1njgv7c,2025-09-17T15:50:45+00:00,fashion,Wednesday’s work outfit.,olchai_mp3,492,60,Outfit of The Day,False,False
1njfdon,2025-09-17T14:55:04+00:00,fashion,Ootd,Top_Presentation_939,586,37,Outfit of The Day,False,False
1njc0nl,2025-09-17T12:39:48+00:00,fashion,Just some more work looks,Candid_Chemical_4836,202,35,👔👗Fashion Show 👗 👔,False,False
1nj6b3k,2025-09-17T07:09:35+00:00,fashion,OOTD,Paranoid-Intuition1,305,11,Outfit of The Day,False,False
1nj17ek,2025-09-17T02:29:09+00:00,fashion,"What do we think of this sweater thing I found? I personally like it, but I’m curious!",Faeriemary,1066,121,Opinion 💅,False,False
1nj0nil,2025-09-17T02:02:42+00:00,fashion,which bottoms for this top (for a date)?,starrypond,260,526,Advice Wanted Please! ,False,False
1nixjes,2025-09-16T23:39:19+00:00,fashion,"Major purchase, no ""ragrets"", how would you style it?",julesmacmarie,142,41,Special Occasion Outfit,False,False
1nit1lg,2025-09-16T20:37:03+00:00,fashion,Vintage D&G set. What do you think?,thehotpollo,79,12,Opinion 💅,False,False
1niq68l,2025-09-16T18:50:30+00:00,fashion,feeling very 🦢 today,thelastpegasus,115,12,Outfit of The Day,False,False
1nio8v3,2025-09-16T17:40:42+00:00,fashion,My outfit today. OOTD,Linatoi,1536,62,Outfit of The Day,False,False
1niln0a,2025-09-16T16:05:00+00:00,fashion,"When in doubt, wear black",olchai_mp3,742,61,Outfit of The Day,False,False
1nikz6e,2025-09-16T15:40:10+00:00,fashion,Yay or nay?,curtjamesreddit,52,26,Feedback Wanted! ,False,False
1nikr8o,2025-09-16T15:31:56+00:00,fashion,"When I’m not busy chasing after kids, I pose",ComprehensiveAge6604,52,9,Outfit of The Day,False,False
1niiz9y,2025-09-16T14:26:00+00:00,fashion,Thursday outfit (i should add color),HifiAddicted,151,15,Outfit of The Day,False,False
1niflim,2025-09-16T12:06:36+00:00,fashion,Black knit + green pinstripe pants,Duskymoonlight,533,30,Outfit of The Day,False,False
1ni68qx,2025-09-16T03:01:43+00:00,fashion,"Option 1, 2, or 3?",Original_Phrase_7149,136,223,Feedback Wanted! ,False,False
1ni4qnp,2025-09-16T01:49:42+00:00,fashion,Opinions on my business casual outfit for a work event with coworkers that I only wear full sleeve around?,EvaaRayne,95,219,⚠️HONEST⚠️Advice Wanted- I can Handle The Truth!!! ,False,False
1ni4drh,2025-09-16T01:32:55+00:00,fashion,What do you think about some of my looks?,evagriavel,82,38,Feedback Wanted! ,False,False
1ni4cgb,2025-09-16T01:31:16+00:00,fashion,It's Not A Color I Won't Mix Together 😁,Resident-Database-58,155,30,Outfit of The Day,False,False
1nhxs1n,2025-09-15T20:51:06+00:00,fashion,Embracing Culture With Saree,Lunawhispers_Sky,54,3,Special Occasion Outfit,False,False
1nhva35,2025-09-15T19:19:00+00:00,fashion,I need more scarves 😭,Paothebao,51,4,Advice Wanted Please! ,False,False
1nhro9t,2025-09-15T17:07:31+00:00,fashion,Just a monday dress,HifiAddicted,115,13,Outfit of The Day,False,False
1nhrki6,2025-09-15T17:03:41+00:00,fashion,"Keepin’ it sunny, even in September.. 🌞✨",ThistleAndRose,292,20,Outfit of The Day,False,False
1nhriq2,2025-09-15T17:01:55+00:00,fashion,Mondays work outfit.,olchai_mp3,365,39,Outfit of The Day,False,False
1nhoqd6,2025-09-15T15:19:14+00:00,fashion,The beginning of fall fits,mysterious_tiger07,2627,187,Outfit of The Day,False,False
1nhmads,2025-09-15T13:45:58+00:00,fashion,DIY Lady Gaga Meat Dress for Concert,VanGoingPlaces,497,22,🪡🧵DIY 🧵 🪡 ,False,False
1nhescq,2025-09-15T06:51:00+00:00,fashion,Should i return this dress,Kistuegg,119,68,Feedback Wanted! ,False,False
1nhdgp0,2025-09-15T05:29:55+00:00,fashion,Does this dress look good on me?,secumsempra,108,56,Advice Wanted Please! ,False,False
1nh9cda,2025-09-15T01:54:32+00:00,fashion,last of the summer dresses,thelastpegasus,276,20,Outfit of The Day,False,False
1nh8ggp,2025-09-15T01:11:56+00:00,fashion,Only just got back to London so can dress up freely!!,s_white_,281,29,Outfit of The Day,False,False
1nh28ux,2025-09-14T20:39:49+00:00,fashion,Which dress should I wear as a wedding guest?,Financial-Injury8051,329,929,Advice Wanted Please! ,False,False
1nh1or1,2025-09-14T20:17:47+00:00,fashion,Just discovered the wonderful world of putting collared shirts under things,Original_Phrase_7149,66,10,🤩Showcase 🤩,False,False
1nh1f5a,2025-09-14T20:07:34+00:00,fashion,Dimsum with friend,olchai_mp3,156,13,Outfit of The Day,False,False
1ngyiij,2025-09-14T18:14:52+00:00,fashion,I made this dress! I am so in love!,Shammeths,1314,68,🪡🧵DIY 🧵 🪡 ,False,False
1ngx6w2,2025-09-14T17:23:53+00:00,fashion,"Another day, another dress ☺️",Souhwhyarewehere-lol,80,7,Outfit of The Day,False,False
1ngvnb0,2025-09-14T16:24:57+00:00,fashion,White sunday outfit,HifiAddicted,85,5,Outfit of The Day,False,False
1ngrod3,2025-09-14T13:44:01+00:00,fashion,Is this style of pants currently in fashion or out of style?,Interesting-Fact-PC,190,143,Advice Wanted Please! ,False,False
1ngoxap,2025-09-14T11:31:44+00:00,fashion,Styled Scarf tops,Paothebao,52,8,Advice Wanted Please! ,False,False
1nggw5v,2025-09-14T03:36:21+00:00,fashion,What should I wear tomorrow?,Loulou9045,398,114,Feedback Wanted! ,False,False
1ngemt0,2025-09-14T01:38:30+00:00,fashion,Disco dresses,hairystyles123,252,8,Special Occasion Outfit,False,False
1ngc3xj,2025-09-13T23:34:44+00:00,fashion,"It was my birthday this week, tried something fun for the Versace Mansion!",MatthieuFits,240,32,Special Occasion Outfit,False,False
1nga2v2,2025-09-13T22:03:18+00:00,fashion,This week was ROUGH!,Super-Rip-6090,175,21,🤩Showcase 🤩,False,False
1ng4yjo,2025-09-13T18:28:38+00:00,fashion,Does this top go well with the skirt??,ScaredBreakfast6384,119,36,Advice Wanted Please! ,False,False
1ng2jrw,2025-09-13T16:55:34+00:00,fashion,I got this dress a few days ago but idk where i’m going to wear it lol,dualidean0fman,228,41,💕💕Positive Vibes Only💕💕,False,False
1ng1snc,2025-09-13T16:25:02+00:00,fashion,I am in love with this dress!!!,Souhwhyarewehere-lol,998,64,Outfit of The Day,False,False
1nfzhyk,2025-09-13T14:53:52+00:00,fashion,Tried on my goal dress- should I wait to wear it until I lose a little more?,somethingaboutit,1514,426,Feedback Wanted! ,False,False
1nfynmj,2025-09-13T14:18:43+00:00,fashion,I love this fit 🥰,Swimming_Leg_7466,696,37,Outfit of The Day,False,False
1nfxpyj,2025-09-13T13:37:38+00:00,fashion,what is my style?,wxrriedd,181,56,Label My Style ,False,False
1nfvebx,2025-09-13T11:44:20+00:00,fashion,Went to a 60s-themed party. How did I do?,Duskymoonlight,3472,146,💕💕Positive Vibes Only💕💕,False,False
1nfiqls,2025-09-12T23:49:40+00:00,fashion,Thoughts on these outfits ?,Historical-Body-3424,60,32,Feedback Wanted! ,False,False
1nfhshk,2025-09-12T23:06:22+00:00,fashion,Outfit I wore to a festival!! (+ headshot because I couldn’t resist showing off the butterfly clip haha),Souhwhyarewehere-lol,144,12,Outfit of The Day,False,False
1nfc12x,2025-09-12T19:13:42+00:00,fashion,1 or 2 for cocktail attire wedding ?,LakeJunior,94,101,Feedback Wanted! ,False,False
1nf9d2v,2025-09-12T17:28:54+00:00,fashion,Cozy Friday’s  work outfit,olchai_mp3,925,54,Outfit of The Day,False,False
1nf49m0,2025-09-12T14:09:45+00:00,fashion,How could I style this look?,castletowerss,117,37,Advice Wanted Please! ,False,False
1nf3gei,2025-09-12T13:36:32+00:00,fashion,Gen z hates to see a millennial coming 🤣,Ok_Mastodon_8706,6228,796,Outfit of The Day,False,False
1nf1ma2,2025-09-12T12:16:18+00:00,fashion,OOTD in Japan,Paranoid-Intuition1,177,5,Outfit of The Day,False,False
1neifj2,2025-09-11T19:40:55+00:00,fashion,Felt awesome in this outfit!,risktakerr,76,18,Outfit of The Day,False,False
1nedkg9,2025-09-11T16:36:06+00:00,fashion,Update on the House of CB welcome party dress,True_Government_7426,56,4,Outfit of The Day,False,False
1necpym,2025-09-11T16:03:11+00:00,fashion,Thursday’s work outfit,olchai_mp3,633,64,Outfit of The Day,False,False
1ne7jzw,2025-09-11T12:31:33+00:00,fashion,My birthday outfits (day & night outfit) 🥳,okkspace,1226,53,Outfit of The Day,False,False
1ndzum3,2025-09-11T04:46:12+00:00,fashion,Anniversary dinner outfit,olchai_mp3,783,39,Outfit of The Day,False,False
1ndweji,2025-09-11T01:44:28+00:00,fashion,should i get it? :’),drfaustuss,3184,590,Feedback Wanted! ,False,False
1ndw5bk,2025-09-11T01:31:28+00:00,fashion,Is this dress mature or good enough for my 23rd birthday? Opinions on dress plz,LowNight5874,75,44,Advice Wanted Please! ,False,False
1ndv9z6,2025-09-11T00:49:12+00:00,fashion,my style has been changing so much lately,Ok-Shoulder-8721,67,2,Outfit of The Day,False,False
1ndtxoc,2025-09-10T23:44:21+00:00,fashion,Is this a good dress choice for a night at the cinema?,justareallgirl,333,91,Feedback Wanted! ,False,False
1ndrhmd,2025-09-10T21:55:58+00:00,fashion,Does this look y2k enough and how can I make it look more like that style :3,londyn0w0,59,114,Feedback Wanted! ,False,False
1ndqlwk,2025-09-10T21:19:00+00:00,fashion,Cherries!! 🍒,Souhwhyarewehere-lol,206,22,Outfit of The Day,False,False
1ndlwea,2025-09-10T18:14:18+00:00,fashion,"Finally, the first dress I picked off the rack was a winner:)",dualidean0fman,476,21,Special Occasion Outfit,False,False
1ndgyr3,2025-09-10T15:14:55+00:00,fashion,Excited for fall!,DominiqueFlux,352,33,Outfit of The Day,False,False
1nde6yk,2025-09-10T13:27:14+00:00,fashion,Trying to dress down in orange while running errands 🧡,IntrovertedLioness,211,20,Outfit of The Day,False,False
1ndcmgz,2025-09-10T12:18:54+00:00,fashion,Dinner fit,Paranoid-Intuition1,175,9,Outfit of The Day,False,False
1ndci1o,2025-09-10T12:13:12+00:00,fashion,Outfit for a day out,soniyabhegum,290,24,Feedback Wanted! ,False,False
1ndbz0u,2025-09-10T11:48:11+00:00,fashion,my birthday fit🌹 how we lookin⁉️,trainkink,459,131,Special Occasion Outfit,False,False
1ndb3zf,2025-09-10T11:02:46+00:00,fashion,"When in doubt , polka dot 🥰",Swimming_Leg_7466,379,31,Outfit of The Day,False,False
1ncyghk,2025-09-09T23:22:52+00:00,fashion,OOTD but make it alternative,EmoMercyMain,148,14,Outfit of The Day,False,False
1ncud5u,2025-09-09T20:36:19+00:00,fashion,My community orchestra recently relaxed our concert black requirements so now I get to wear my favorite dress! (please pardon my funny lookin mug),TechieInTheTrees,783,49,🤩Showcase 🤩,False,False
1ncnrhz,2025-09-09T16:34:15+00:00,fashion,Was not sure about this combo today...,HifiAddicted,140,31,Feedback Wanted! ,False,False
1ncmbss,2025-09-09T15:40:30+00:00,fashion,I love wearing baggy jeans,justareallgirl,75,6,Outfit of The Day,False,False
1ncmbcg,2025-09-09T15:40:00+00:00,fashion,one of my faves..,AnyaCipher,462,25,Outfit of The Day,False,False
1ncg83l,2025-09-09T11:24:26+00:00,fashion,"OK, I’m obsessed with this outfit 😍",Swimming_Leg_7466,1088,97,Outfit of The Day,False,False
1ncd0km,2025-09-09T08:04:44+00:00,fashion,which wedding guest dress?,Factuallycap,470,423,Advice Wanted Please! ,False,False
1ncakbl,2025-09-09T05:26:54+00:00,fashion,Keep it or not?,,530,75,Feedback Wanted! ,False,False
1ncah72,2025-09-09T05:21:43+00:00,fashion,This top was a gift and I love it so much. 🥹🤓,woodstocksunshine,61,9,Outfit of The Day,False,False
1nc84yb,2025-09-09T03:13:59+00:00,fashion,advice please! skirt 1 or 2?,Ok-Document-5403,232,259,Advice Wanted Please! ,False,False
1nc51mr,2025-09-09T00:45:31+00:00,fashion,♡Outfit from the other day♡,angel_bunny444,62,4,Outfit of The Day,False,False
1nc3kwb,2025-09-08T23:39:46+00:00,fashion,Should I keep or return?,ImagineChange,179,130,Feedback Wanted! ,False,False
1nbz9gr,2025-09-08T20:42:22+00:00,fashion,Monday fit,Disastrous_Body_959,244,27,Outfit of The Day,False,False
1nbyhed,2025-09-08T20:12:35+00:00,fashion,How would you categorize this style?,ActivityFrosty6908,64,37,Label My Style ,False,False
1nbya9i,2025-09-08T20:05:07+00:00,fashion,Is this outfit good for my body type? I'm looking to improve my style but I think it's too basic.,Fearless-Poetry-6163,61,14,Feedback Wanted! ,False,False
1nbwu6o,2025-09-08T19:10:33+00:00,fashion,Wearing an Áo Dài ✨,Truc_anh,421,41,Special Occasion Outfit,False,False
1nbvq2p,2025-09-08T18:28:55+00:00,fashion,Help me choose a dress for my friend's birthday (dinner and club),lady_berserker,665,332,Advice Wanted Please! ,False,False
1nbu6bh,2025-09-08T17:32:23+00:00,fashion,Monday’s work outfit. Keeping it simple,olchai_mp3,674,38,Outfit of The Day,False,False
1nbrjns,2025-09-08T15:56:08+00:00,fashion,Bringing in fall cardigans and light jackets weather. Happy Monday ✨️,Important_Cod_8970,205,10,Outfit of The Day,False,False
1nbqpzt,2025-09-08T15:24:59+00:00,fashion,Comfy fit from the weekend 〰️,avgthrowaway13,53,3,🚫NO Advice Wanted!!!🚫,False,False
1nbp6lk,2025-09-08T14:26:34+00:00,fashion,Vintage Polka Dot Dress,Ok_Mastodon_8706,62,4,Outfit of The Day,False,False
1nbn52x,2025-09-08T13:02:07+00:00,fashion,Going to a concert<3 rate it?,Michaelscottera,83,24,Outfit of The Day,False,False
1nbmy5o,2025-09-08T12:54:06+00:00,fashion,From my work event ❤️,Swimming_Leg_7466,653,52,Special Occasion Outfit,False,False
1nblwk0,2025-09-08T12:05:56+00:00,fashion,"Invited to a friends party,which one?",Michaelscottera,78,66,Opinion 💅,False,False
