id,created_iso,subreddit,title,author,score,num_comments,link_flair_text,over_18,is_self
1o4oe31,2025-10-12T12:57:27+00:00,fashion,A lovely night out to remember 🖤🍣,amakaae,75,4,Outfit of The Day,False,False
1o4o5jd,2025-10-12T12:46:07+00:00,fashion,Is this outfit nice?,Electronic_Job_9259,263,69,Feedback Wanted! ,False,False
1o4lkv9,2025-10-12T10:25:12+00:00,fashion,Opinion on this outfit,Nikkixx_bb,57,23,Feedback Wanted! ,False,False
1o4leuc,2025-10-12T10:15:06+00:00,fashion,Today’s outfit for college,MintyWalk,95,11,Outfit of The Day,False,False
1o4k1ed,2025-10-12T08:46:52+00:00,fashion,Party fit,Taniya6666,63,6,Special Occasion Outfit,False,False
1o4hbdx,2025-10-12T05:54:26+00:00,fashion,Date night,Either-Spite620,87,8,Outfit of The Day,False,False
1o4h2ac,2025-10-12T05:39:22+00:00,fashion,Fit of the day!,Temporary-Camera-891,83,24,Outfit of The Day,False,False
1o4ff92,2025-10-12T04:03:45+00:00,fashion,Yesterday's fit,conniemhunt,619,43,Outfit of The Day,False,False
1o4deh1,2025-10-12T02:15:51+00:00,fashion,Dinner & Drinks 🥃,BioticBard,208,38,Outfit of The Day,False,False
1o4aps9,2025-10-12T00:01:10+00:00,fashion,Autumn Colors,Ok_Mastodon_8706,51,10,Outfit of The Day,False,False
1o46npr,2025-10-11T20:59:59+00:00,fashion,Quinceañera dress help: what I picked,Dazzling_Rabbit_1279,228,59,Special Occasion Outfit,False,False
1o42r6r,2025-10-11T18:19:52+00:00,fashion,Cool casual fit to get a chai latte and walk around the farmers market in,Chalaladingdong,359,54,Feedback Wanted! ,False,False
1o427ku,2025-10-11T17:58:03+00:00,fashion,Casual Halloween outfit 🎃 💀,Vintagesickness,85,10,Outfit of The Day,False,False
1o3zfot,2025-10-11T16:06:18+00:00,fashion,Today's outfit,Friendly-Emmy,128,17,Feedback Wanted! ,False,False
1o3ykj3,2025-10-11T15:31:30+00:00,fashion,Today’s outfit of the day since is getting colder,Blueeyeboo,50,7,Outfit of The Day,False,False
1o3w9o1,2025-10-11T13:55:45+00:00,fashion,Fit > labels $8 thrift store find,Swimming_Leg_7466,243,33,Outfit of The Day,False,False
1o3u1fo,2025-10-11T12:11:49+00:00,fashion,First time wearing baggy jeans 👖,IntrovertedLioness,87,13,Outfit of The Day,False,False
1o3klzg,2025-10-11T02:54:32+00:00,fashion,What ca. I wear under this dress?,Pretty-West-1001,95,87,Advice Wanted Please! ,False,False
1o3evcm,2025-10-10T22:20:20+00:00,fashion,Rate my outfit!,Michaelscottera,63,31,Opinion 💅,False,False
1o3d2st,2025-10-10T21:07:58+00:00,fashion,Been a while since I’ve posted lol,Souhwhyarewehere-lol,217,7,Outfit of The Day,False,False
1o37vea,2025-10-10T17:49:39+00:00,fashion,disco ball vibes 🪩,DelanceyFox,88,5,Outfit of The Day,False,False
1o35mrq,2025-10-10T16:26:19+00:00,fashion,Our fit to go to the Musuem together,gamerskaterchef,131,27,Outfit of The Day,False,False
1o34l5a,2025-10-10T15:47:58+00:00,fashion,Cute or dump?,Fast_Ease_9885,250,66,Outfit of The Day,False,False
1o2zu60,2025-10-10T12:42:39+00:00,fashion,Yay or nay?,curtjamesreddit,175,76,Feedback Wanted! ,False,False
1o2zayn,2025-10-10T12:18:06+00:00,fashion,"Friday vibes, so happy to be in weekend !",HifiAddicted,224,4,Outfit of The Day,False,False
1o2qg0o,2025-10-10T03:37:25+00:00,fashion,Does this top and skirt work?,Middle_Layer1533,105,53,Feedback Wanted! ,False,False
1o2n03e,2025-10-10T00:49:44+00:00,fashion,Whole Outfit From Amazon! My Dinner Party Outfit:,No_Atmosphere_8987,779,67,Special Occasion Outfit,False,False
1o2lou7,2025-10-09T23:47:31+00:00,fashion,How can I dress classy as a 17 year old?,Scared_Bluejay5608,103,71,Advice Wanted Please! ,False,False
1o2fqet,2025-10-09T19:43:18+00:00,fashion,Gifted by my bsf,Taniya6666,76,10,Outfit of The Day,False,False
1o2ff7p,2025-10-09T19:31:02+00:00,fashion,Went partying in that fit,mysterious_tiger07,449,31,Outfit of The Day,False,False
1o2f926,2025-10-09T19:24:20+00:00,fashion,Date nighttt💗💗,SorbetInside8775,1352,222,Outfit of The Day,False,False
1o2bui5,2025-10-09T17:14:59+00:00,fashion,simple and cute ootd 🌺🌸,Senit-Junowicz,56,5,Outfit of The Day,False,False
1o2bpdc,2025-10-09T17:09:38+00:00,fashion,Simple and comfy ootd,Blueeyeboo,116,9,Outfit of The Day,False,False
1o2bngf,2025-10-09T17:07:40+00:00,fashion,Simple and clean...,AnyaCipher,83,21,Feedback Wanted! ,False,False
1o2bd6q,2025-10-09T16:57:09+00:00,fashion,Outfit of the day on a day full of castings ✨,bbjeanofficial,313,37,Outfit of The Day,False,False
1o25s14,2025-10-09T13:21:35+00:00,fashion,Is Denim on Denim okay?,MTKings,79,45,Feedback Wanted! ,False,False
1o25ct6,2025-10-09T13:03:20+00:00,fashion,Please give me your honest opinion,Competitive-Leg6506,149,112,Feedback Wanted! ,False,False
1o230sl,2025-10-09T11:08:09+00:00,fashion,I'm not an influencer but this dress is influential <3,conniemhunt,359,32,🤩Showcase 🤩,False,False
1o1usly,2025-10-09T02:43:44+00:00,fashion,Feeling pretty,yourcutiepatootiepoo,52,17,Outfit of The Day,False,False
1o1rdc4,2025-10-08T23:59:24+00:00,fashion,White corset and black shorts combo!,Cute-Designer011,119,12,Outfit of The Day,False,False
1o1rca8,2025-10-08T23:58:05+00:00,fashion,Date night fit. Hubby loved it 💕,Such-Entertainer-680,209,15,Special Occasion Outfit,False,False
1o1o2wc,2025-10-08T21:35:02+00:00,fashion,Too classy? Or suited for work too,VegaRatioByH3,476,65,Feedback Wanted! ,False,False
1o1l97v,2025-10-08T19:55:08+00:00,fashion,quince tings 💃🏻,Dramatic-Quiet-818,152,9,Special Occasion Outfit,False,False
1o1ej9r,2025-10-08T15:59:18+00:00,fashion,OOTD,Blueeyeboo,74,11,Outfit of The Day,False,False
1o1blx6,2025-10-08T14:12:03+00:00,fashion,This is going to be my outfit today,Queenregina32__,407,19,Outfit of The Day,False,False
1o1aw38,2025-10-08T13:44:24+00:00,fashion,Combat boots,Kitchen-Capital3817,215,32,🤩Showcase 🤩,False,False
1o16n1c,2025-10-08T10:21:34+00:00,fashion,black or white?,19statics,2182,551,Advice Wanted Please! ,False,False
1o16eop,2025-10-08T10:07:51+00:00,fashion,Outfit for night club,funnyChic1201,484,23,🤩Showcase 🤩,False,False
1o14tiz,2025-10-08T08:24:21+00:00,fashion,New autumn vibes,HifiAddicted,359,22,Outfit of The Day,False,False
1o12jm5,2025-10-08T05:59:13+00:00,fashion,Fixed the skirt problem,Electronic_Job_9259,72,11,🪡🧵DIY 🧵 🪡 ,False,False
1o11mrx,2025-10-08T05:03:56+00:00,fashion,grad school graduation 🥳,Current_Criticism_61,121,13,Special Occasion Outfit,False,False
1o11ha7,2025-10-08T04:55:26+00:00,fashion,ootd denim+white top 🤍,Senit-Junowicz,153,14,Outfit of The Day,False,False
1o0xj6m,2025-10-08T01:33:18+00:00,fashion,Does this outfit come off as “slutty”? My bestfriend is always so weird about the boots in particular!,melancholicdoe,220,125,Feedback Wanted! ,False,False
1o0vnu0,2025-10-08T00:07:00+00:00,fashion,I ended up going with this dress for my sister’s wedding,Mileeeenax,742,61,Wedding Attire Approval,False,False
1o0t3xh,2025-10-07T22:16:59+00:00,fashion,Ignore the mess I’m playing dress up 😅 but how fricken cute is this fit????!!!!,Chalaladingdong,180,20,Feedback Wanted! ,False,False
1o0svxc,2025-10-07T22:08:16+00:00,fashion,Came home to an early Birthday surprise. Thoughts?,BioticBard,322,64,Feedback Wanted! ,False,False
1o0rfvf,2025-10-07T21:12:24+00:00,fashion,Beach wedding guest attire,Ok-Strategy-3595,78,10,Feedback Wanted! ,False,False
1o0mxw8,2025-10-07T18:27:27+00:00,fashion,This is how I dressed today.,Queenregina32__,141,5,Outfit of The Day,False,False
1o0lj35,2025-10-07T17:37:42+00:00,fashion,Tuesdays work outfit: mad men vibes,olchai_mp3,343,31,Outfit of The Day,False,False
1o0jnvw,2025-10-07T16:31:31+00:00,fashion,Watchu think?,Electronic_Job_9259,53,31,Feedback Wanted! ,False,False
1o0alja,2025-10-07T10:05:03+00:00,fashion,WIWT,vyuella,65,5,Outfit of The Day,False,False
1o0913t,2025-10-07T08:25:15+00:00,fashion,Stitched this Cute top for myself! How does it look on me?,kanyakumariii,64,12,Opinion 💅,False,False
1o059a3,2025-10-07T04:33:08+00:00,fashion,ootd 👗,Senit-Junowicz,126,8,Outfit of The Day,False,False
1o039n8,2025-10-07T02:49:03+00:00,fashion,Thought I would try some colour ❤️,kxfrac,248,38,🚫NO Advice Wanted!!!🚫,False,False
1o01v9t,2025-10-07T01:42:47+00:00,fashion,Best way to wear the vest?,room_tempurature_tea,160,91,Feedback Wanted! ,False,False
1o00ft6,2025-10-07T00:36:47+00:00,fashion,Meeting Boyfriend’s Mom!,Severe_Coconut1117,547,204,Advice Wanted Please! ,False,False
1o004td,2025-10-07T00:22:36+00:00,fashion,Help!! Which dress?,mayormaynotbeanna,164,353,Advice Wanted Please! ,False,False
1nzxsx0,2025-10-06T22:39:37+00:00,fashion,"Shiny, pink, and sequins? I think yes",Cute-Designer011,89,3,Outfit of The Day,False,False
1nzujy2,2025-10-06T20:34:04+00:00,fashion,Is it a good beach cocktail wedding outfit? TY! ♥️,Bright-Pudding-392,264,89,Advice Wanted Please! ,False,False
1nzsstg,2025-10-06T19:31:05+00:00,fashion,A cute and relaxed outfit. What do you think?,Queenregina32__,173,20,Outfit of The Day,False,False
1nzmejt,2025-10-06T15:35:22+00:00,fashion,Is it a good outfit for prom,WrongReplacement5322,144,13,Outfit of The Day,False,False
1nzjf8d,2025-10-06T13:42:55+00:00,fashion,👖kind of day,Blueberryvodka248,68,4,💕💕Positive Vibes Only💕💕,False,False
1nzgqlm,2025-10-06T11:44:23+00:00,fashion,I am proud of this outfift lol,ChizUrU_tan,287,54,💕💕Positive Vibes Only💕💕,False,False
1nzfgbf,2025-10-06T10:35:01+00:00,fashion,too late to post Sunday brunch outfit? xD,conniemhunt,979,58,Outfit of The Day,False,False
1nzf17h,2025-10-06T10:10:10+00:00,fashion,Another dress added to my collection 👗,Senit-Junowicz,156,14,🤩Showcase 🤩,False,False
1nz6m09,2025-10-06T01:56:39+00:00,fashion,Which dress should I wear for my Convocation?,Cute_Musician3920,104,196,Advice Wanted Please! ,False,False
1nz06lq,2025-10-05T21:08:12+00:00,fashion,My first suit. Thoughts?,One_Sock6969,131,47,Feedback Wanted! ,False,False
1nyywlp,2025-10-05T20:19:11+00:00,fashion,Been trying out different styles!,Temporary-Camera-891,146,18,Outfit of The Day,False,False
1nyvmdd,2025-10-05T18:15:10+00:00,fashion,My Yellowstone stone era,DominiqueFlux,78,6,Outfit of The Day,False,False
1nyszff,2025-10-05T16:36:33+00:00,fashion,Update: I chose the black dress,KibbyKatie,1116,57,Special Occasion Outfit,False,False
1nys270,2025-10-05T16:01:13+00:00,fashion,ootd 🌸,Senit-Junowicz,163,12,Outfit of The Day,False,False
1nyrt7p,2025-10-05T15:51:40+00:00,fashion,"su,,y sundays",HifiAddicted,50,11,🚫NO Advice Wanted!!!🚫,False,False
1nyqvgi,2025-10-05T15:15:35+00:00,fashion,How to style this? I think I HAVE to wear it.,typewriter-fiasco,159,131,🔒Lock My Comments!🔒 ,False,False
1nyl91h,2025-10-05T11:01:02+00:00,fashion,Got mocked all night for my outfit - is this too much ?,Estelle_San,2118,634,Feedback Wanted! ,False,False
1nyjsr1,2025-10-05T09:32:35+00:00,fashion,My outfit today,Sweaty_Ad_9349,162,16,Outfit of The Day,False,False
1nyhcen,2025-10-05T06:58:42+00:00,fashion,My outfit today 🤎 OOTD,Linatoi,580,16,Outfit of The Day,False,False
1nygucs,2025-10-05T06:28:30+00:00,fashion,Simple white dress for today,DuskPrincessx,203,20,💕Positive Vibes ONLY💕,False,False
1ny8x0x,2025-10-04T23:30:44+00:00,fashion,Hosted a party,olchai_mp3,1923,89,Special Occasion Outfit,False,False
1ny52t3,2025-10-04T20:47:39+00:00,fashion,Girls night,Tiny-Chemistry-5042,486,23,Outfit of The Day,False,False
1nxzujz,2025-10-04T17:21:51+00:00,fashion,Office Outfit,Few-Olive-6259,470,33,Outfit of The Day,False,False
1nxztsv,2025-10-04T17:21:04+00:00,fashion,Italian fits pt.2,Username0001010,1580,89,👔👗Fashion Show 👗 👔,False,False
1nxxu4v,2025-10-04T16:01:58+00:00,fashion,Outfit to see some of my favourite bands 🖤,kxfrac,180,24,Outfit of The Day,False,False
1nxvbh6,2025-10-04T14:22:53+00:00,fashion,UPDATE: My Halloween fit,rockmydna,76,11,🕷️Spooky Season🕷️,False,False
1nxuveo,2025-10-04T14:04:47+00:00,fashion,country music festival day 1!,PutridMuscle9886,81,6,Outfit of The Day,False,False
1nxut02,2025-10-04T14:02:00+00:00,fashion,Clueless Vibes,Ok_Mastodon_8706,409,19,Outfit of The Day,False,False
1nxqe3n,2025-10-04T10:25:36+00:00,fashion,OOTD ☀️,travel-girly90,54,3,Outfit of The Day,False,False
1nxmss6,2025-10-04T06:39:37+00:00,fashion,UPDATE: Snow White costume PLAIN BLUE BODICE or WITH GOLD TRIMMING?,Sea-Cookie-8572,68,13,💕Positive Vibes ONLY💕,False,False
1nxlpby,2025-10-04T05:34:37+00:00,fashion,What's your favorite dress color?,charmyshine,65,9,Outfit of The Day,False,False
1nxlfmo,2025-10-04T05:18:44+00:00,fashion,Wedding Invite outfits,Brendarks0,75,52,Advice Wanted Please! ,False,False
1nxdj0t,2025-10-03T22:43:35+00:00,fashion,okay this is what i officially wore to my interview today,starrypond,1498,122,Outfit of The Day,False,False
1nxd3ba,2025-10-03T22:24:25+00:00,fashion,Which dress?,Apprehensive-Cow4619,739,1601,Feedback Wanted! ,False,False
1nxam41,2025-10-03T20:42:59+00:00,fashion,because i’ve been posting my outfits…,anotherrandomm1,102,14,Outfit of The Day,False,False
1nx7n7y,2025-10-03T18:48:14+00:00,fashion,my homecoming dress!!,peavle,376,42,Special Occasion Outfit,False,False
1nx73fy,2025-10-03T18:27:22+00:00,fashion,Love this dress! I feel like I'm wearing a quilt!,Legitimate_Entry_444,338,31,Outfit of The Day,False,False
1nx4hf8,2025-10-03T16:50:10+00:00,fashion,Outfit to stay at home (:,Rita_Pacheco,352,40,Outfit of The Day,False,False
1nx3w9k,2025-10-03T16:28:24+00:00,fashion,Sinking into black and white as of late,Disposeofmenever,131,30,Outfit of The Day,False,False
1nwymtf,2025-10-03T13:06:43+00:00,fashion,Marshall’s is where I always find the Best buy’s!! Were do you recommend?,Blueeyeboo,92,13,Feedback Wanted! ,False,False
1nwwykh,2025-10-03T11:51:09+00:00,fashion,Friday work fit,KikayLemaitre,52,3,Feedback Wanted! ,False,False
1nwstvg,2025-10-03T07:46:15+00:00,fashion,Date Night outfit when I was pregnant,Such-Entertainer-680,99,25,Special Occasion Outfit,False,False
1nws3a1,2025-10-03T06:58:08+00:00,fashion,my homecoming dress!!,Junior-Breadfruit832,621,24,Special Occasion Outfit,False,False
1nwmy3f,2025-10-03T02:10:31+00:00,fashion,outfit for classes today :),anotherrandomm1,175,18,Outfit of The Day,False,False
1nwmp89,2025-10-03T01:58:41+00:00,fashion,Yom Kippur🕍✡️🕍,Money_Hovercraft_985,53,16,Outfit of The Day,False,False
1nwif5e,2025-10-02T22:41:13+00:00,fashion,Spring park day :),momentodefluir,106,3,Outfit of The Day,False,False
1nwhgbt,2025-10-02T22:01:03+00:00,fashion,which top for an interview? (pt 2 lol),starrypond,91,234,Advice Wanted Please! ,False,False
1nwgz90,2025-10-02T21:42:11+00:00,fashion,Thrifted fit of the day!,wondercookiestar,81,6,Outfit of The Day,False,False
1nwa6lq,2025-10-02T17:29:19+00:00,fashion,Very simple outfit today …I was lazy but headed out to brunch with the ladies.,diamondenthusiaist,247,29,Outfit of The Day,False,False
1nw96m2,2025-10-02T16:52:30+00:00,fashion,is this a good interview fit?,starrypond,250,159,Feedback Wanted! ,False,False
1nw8dlb,2025-10-02T16:22:23+00:00,fashion,Thursday’s work outfit,olchai_mp3,1220,55,Outfit of The Day,False,False
1nw1uqe,2025-10-02T12:02:53+00:00,fashion,Found the perfect lighting on a night out,izz-mg,723,38,Outfit of The Day,False,False
1nw1qjf,2025-10-02T11:57:12+00:00,fashion,Yay or nay?,curtjamesreddit,161,117,Feedback Wanted! ,False,False
1nvqvgj,2025-10-02T01:39:59+00:00,fashion,Post-client event fit check after a 13-hour day,BioticBard,513,65,Outfit of The Day,False,False
1nvpd33,2025-10-02T00:28:51+00:00,fashion,Second hand + tailor+cobbler+ my literal swag 👗,ruralmonalisa,121,11,👔👗Fashion Show 👗 👔,False,False
1nvlhc0,2025-10-01T21:42:24+00:00,fashion,outfit,kodiakinsomniaque,130,33,Outfit of The Day,False,False
1nvgejz,2025-10-01T18:32:42+00:00,fashion,Some Italian vacation fits,Username0001010,2019,236,👔👗Fashion Show 👗 👔,False,False
1nveked,2025-10-01T17:26:57+00:00,fashion,A or B?,Antibes1939,85,279,Advice Wanted Please! ,False,False
1nv9a94,2025-10-01T14:11:38+00:00,fashion,3ways which is the best look?,KikayLemaitre,53,48,Advice Wanted Please! ,False,False
1nv844s,2025-10-01T13:24:24+00:00,fashion,Which color suit works best,SupportActual8829,73,180,Feedback Wanted! ,False,False
1nv66tv,2025-10-01T11:58:08+00:00,fashion,It’s a bowtiful life 🎀,Ok_Mastodon_8706,127,12,Outfit of The Day,False,False
1nv0i5o,2025-10-01T06:04:59+00:00,fashion,Bridal shower - help pick a dress,Trick_Cloud8897,183,577,Feedback Wanted! ,False,False
1nuz14k,2025-10-01T04:39:13+00:00,fashion,help me accessorise this fit,Maleficent_Bat8975,117,24,Outfit of The Day,False,False
1nupyb9,2025-09-30T21:33:24+00:00,fashion,My outfit today. OOTD 💗,AnyaCipher,169,9,Outfit of The Day,False,False
1nupoix,2025-09-30T21:22:40+00:00,fashion,Corset and shorts for a casual/fitted combo,Cute-Designer011,126,12,Outfit of The Day,False,False
1nuo0st,2025-09-30T20:19:03+00:00,fashion,outfit for a party :),anotherrandomm1,105,14,Label My Style ,False,False
1nujouj,2025-09-30T17:37:07+00:00,fashion,Love this dress,olchai_mp3,152,14,💕Positive Vibes ONLY💕,False,False
1nuhc93,2025-09-30T16:08:29+00:00,fashion,Dress over pants - does it work?,Duskymoonlight,25109,1430,Feedback Wanted! ,False,False
1nuh3kb,2025-09-30T15:59:39+00:00,fashion,Yellow vibes today :),HifiAddicted,225,14,Outfit of The Day,False,False
1nugo6k,2025-09-30T15:43:25+00:00,fashion,Outfit of the day!,wondercookiestar,65,5,Outfit of The Day,False,False
1nubv2c,2025-09-30T12:29:29+00:00,fashion,Fit check,bampfman22,165,51,Label My Style ,False,False
1nua44r,2025-09-30T11:00:49+00:00,fashion,Do these outfit pieces look good together?,Electronic_Job_9259,209,47,Feedback Wanted! ,False,False
1nu83tw,2025-09-30T08:55:15+00:00,fashion,Casual fit,funnyChic1201,169,18,Outfit of The Day,False,False
1nu5bn0,2025-09-30T05:56:02+00:00,fashion,Outfit of the day))),Hateurlly,111,5,Outfit of The Day,False,False
1nu0sw5,2025-09-30T01:59:12+00:00,fashion,"Hear ye, hear ye 🍂🗡️",RedditRee06,77,18,Special Occasion Outfit,False,False
1ntzn7q,2025-09-30T01:04:52+00:00,fashion,A moment for this Ronny Kobo dress,kateyblaire,54,3,Outfit of The Day,False,False
1ntvn6k,2025-09-29T22:08:32+00:00,fashion,Latest autumn fit,mysterious_tiger07,317,11,Outfit of The Day,False,False
1ntpyti,2025-09-29T18:31:19+00:00,fashion,Fun fall fit ✨️,Important_Cod_8970,84,5,Outfit of The Day,False,False
1ntmnid,2025-09-29T16:27:45+00:00,fashion,Mondays work outfit. Fall fashion has officially started 😊,olchai_mp3,1573,86,Outfit of The Day,False,False
1ntjfwd,2025-09-29T14:26:03+00:00,fashion,Monday routine,HifiAddicted,83,4,Outfit of The Day,False,False
1ntgpc8,2025-09-29T12:29:57+00:00,fashion,Never understood the 'hate' for skinny jeans,okkspace,549,73,Outfit of The Day,False,False
1ntgp3s,2025-09-29T12:29:39+00:00,fashion,Chanel inspired 🎀,Swimming_Leg_7466,560,59,Outfit of The Day,False,False
1ntbw6m,2025-09-29T07:39:36+00:00,fashion,Thrifted fit,Paothebao,84,7,Outfit of The Day,False,False
1nt5xhf,2025-09-29T01:54:31+00:00,fashion,1950s again,Miss_v_007,92,3,Outfit of The Day,False,False
1nt5slq,2025-09-29T01:47:43+00:00,fashion,Should I wear something else to cover my arms instead of the white long sleeve?,throwra379474729,130,91,Advice Wanted Please! ,False,False
1nt1u6e,2025-09-28T22:38:05+00:00,fashion,Loving this dress 😍,Swimming_Leg_7466,785,56,Outfit of The Day,False,False
1nszlrz,2025-09-28T21:03:12+00:00,fashion,My dress for 10 years wedding anniversary. What do you think?,AbleDepartment648,425,74,Advice Wanted Please! ,False,False
1nsu8sr,2025-09-28T17:31:07+00:00,fashion,Dinner night in the city 🖤,amakaae,920,46,Outfit of The Day,False,False
1nsttch,2025-09-28T17:14:26+00:00,fashion,Sewed this dress to wear to my cousins wedding!,Alycevs,19126,840,Special Occasion Outfit,False,False
1nsrbb3,2025-09-28T15:33:07+00:00,fashion,Dressing to make myself happy today. 🌻,aerial_alien,247,38,Outfit of The Day,False,False
1nso1pw,2025-09-28T13:14:25+00:00,fashion,Concert outfit (indoor venue),Confident-Area-4254,315,33,Special Occasion Outfit,False,False
1nsl71d,2025-09-28T10:44:22+00:00,fashion,Bought this dress yesterday and I am certainly loving it 😊,asian_geeky,227,32,Special Occasion Outfit,False,False
1nsk5dq,2025-09-28T09:37:56+00:00,fashion,My outfit for Mid Autumn festival,AbleDepartment648,141,14,Outfit of The Day,False,False
1nsgiu5,2025-09-28T05:45:38+00:00,fashion,What to wear for an ID photo?,Miserable_Eagle_6202,63,66,Advice Wanted Please! ,False,False
1nse514,2025-09-28T03:29:02+00:00,fashion,Outfit of the day!,ilovetheweeeknd,86,4,Outfit of The Day,False,False
1ns960c,2025-09-27T23:12:29+00:00,fashion,I need help picking a cover photo for this outfit! Which one stands out the most?,snugglebunbun,52,40,Advice Wanted Please! ,False,False
1ns8s0p,2025-09-27T22:54:07+00:00,fashion,Fit check. Thoughts?,bampfman22,73,52,Feedback Wanted! ,False,False
1ns65hs,2025-09-27T20:57:58+00:00,fashion,"Dinner, what shoe?",vilahoney,476,341,Feedback Wanted! ,False,False
1ns36gd,2025-09-27T18:54:45+00:00,fashion,"birthday dress for tuesday, do you guys think it looks good?",Dry_Relief4663,172,38,Feedback Wanted! ,False,False
1ns1wt4,2025-09-27T18:03:28+00:00,fashion,Dinner 👗,Blueberryvodka248,131,7,Outfit of The Day,False,False
1nrzvc2,2025-09-27T16:41:49+00:00,fashion,"Bad background, cute outfit",The-Names-Prince,118,63,Outfit of The Day,False,False
1nrx9o9,2025-09-27T14:55:27+00:00,fashion,Coffee date with a friend. Embracing the last warm days before the cold begins,Duskymoonlight,777,45,Outfit of The Day,False,False
1nrwfzq,2025-09-27T14:19:42+00:00,fashion,Long time looker 👀. First time poster 🙈💕,Lilith-Sky14,93,22,Outfit of The Day,False,False
1nrv0nx,2025-09-27T13:17:28+00:00,fashion,Cosy saturday,Emmama75,106,11,Outfit of The Day,False,False
1nrsg5o,2025-09-27T11:05:22+00:00,fashion,Yay or nay?,curtjamesreddit,97,93,Feedback Wanted! ,False,False
1nrs6z8,2025-09-27T10:50:26+00:00,fashion,Wedding guest outfit,Tiny-Chemistry-5042,747,41,Outfit of The Day,False,False
1nrbuep,2025-09-26T20:18:56+00:00,fashion,My style :),Key-Front392,442,48,Outfit of the Day ⛔️No Advice/No Critics!⛔️,False,False
1nr9md0,2025-09-26T18:52:28+00:00,fashion,my 30th birthday outfit,anonimus_blond,1645,112,Outfit of The Day,False,False
1nr6zqb,2025-09-26T17:09:14+00:00,fashion,thought i'd post my fit for today since a lot of you guys liked my other outfits,htx-danny,57,3,Outfit of The Day,False,False
1nr3vfa,2025-09-26T15:09:27+00:00,fashion,I got this dress to wear to an upcoming wedding :),dualidean0fman,389,77,Special Occasion Outfit,False,False
1nr3txz,2025-09-26T15:07:54+00:00,fashion,New skirt - which top?,OftenMe,787,925,Feedback Wanted! ,False,False
1nr1yap,2025-09-26T13:53:15+00:00,fashion,My outfit for the university,Sweaty_Ad_9349,389,45,Outfit of The Day,False,False
1nqyvzq,2025-09-26T11:31:38+00:00,fashion,Autumn vibes again :),HifiAddicted,100,4,Outfit of The Day,False,False
1nqv019,2025-09-26T07:29:41+00:00,fashion,TGIF,Emmama75,486,19,Outfit of The Day,False,False
1nqswga,2025-09-26T05:18:39+00:00,fashion,Casual fit,Paranoid-Intuition1,62,3,Outfit of The Day,False,False
1nqqtht,2025-09-26T03:23:17+00:00,fashion,how good are these jeans,thelastpegasus,88,51,Outfit of The Day,False,False
1nqj2na,2025-09-25T21:23:49+00:00,fashion,a few fits,htx-danny,247,46,Outfit of The Day,False,False
1nqhnki,2025-09-25T20:27:27+00:00,fashion,Coffee date! ☕️✨,,1280,59,Outfit of The Day,False,False
1nqcryt,2025-09-25T17:20:32+00:00,fashion,Day 3 conference outfit,olchai_mp3,908,72,Outfit of The Day,False,False
1nqbpbc,2025-09-25T16:40:00+00:00,fashion,Today's outfit ✨️,MetalWest3917,531,19,Outfit of The Day,False,False
1nqberb,2025-09-25T16:28:39+00:00,fashion,first post here :) animal print today 🐾🤎,DelanceyFox,198,19,Outfit of The Day,False,False
1nqa4zq,2025-09-25T15:40:04+00:00,fashion,Good rainy day preppy fit?,BraveName343,113,32,Feedback Wanted! ,False,False
1nq9qrr,2025-09-25T15:24:54+00:00,fashion,"Wedding Guest Help: 1, 2, 3 or 4",KibbyKatie,128,50,Advice Wanted Please! ,False,False
1nq8klp,2025-09-25T14:40:03+00:00,fashion,Hufflepuff fit with an Alex Russo twist to go visit Hogwarts and Hogsmeade at Universal 😊,Chalaladingdong,54,4,Feedback Wanted! ,False,False
1nq3miv,2025-09-25T10:56:53+00:00,fashion,My outfit makes me feel wonderful,justareallgirl,128,20,Feedback Wanted! ,False,False
1nq3697,2025-09-25T10:30:37+00:00,fashion,Something different today !,HifiAddicted,86,9,Outfit of The Day,False,False
1nq001x,2025-09-25T07:03:21+00:00,fashion,Today's outfit,Emmama75,1134,54,Outfit of The Day,False,False
1npwtj0,2025-09-25T03:52:28+00:00,fashion,New Jeans 🌸,Ok_Mastodon_8706,112,29,Outfit of The Day,False,False
1npnb9q,2025-09-24T20:36:46+00:00,fashion,My snake dress,Sweaty_Ad_9349,62,3,Outfit of The Day,False,False
1nplyfv,2025-09-24T19:44:16+00:00,fashion,good morning🪷,thelastpegasus,101,7,Outfit of The Day,False,False
1npgngn,2025-09-24T16:22:21+00:00,fashion,Day 2 conference outfit,olchai_mp3,2207,99,Outfit of The Day,False,False
1np87w9,2025-09-24T10:07:22+00:00,fashion,My outfit today! OOTD,Linatoi,856,37,Outfit of The Day,False,False
1np0yju,2025-09-24T02:44:32+00:00,fashion,Does this outfit works? (I was trying to find ways to use this overall that I dislike),Hot_Stress9899,217,69,Feedback Wanted! ,False,False
1np0p2n,2025-09-24T02:31:22+00:00,fashion,these knee high boots: yay or nay?,sodespicable,477,90,Opinion 💅,False,False
1novaq8,2025-09-23T22:21:44+00:00,fashion,The fit I wore to universal’s Halloween Horror Nights 🤭 we like?,Chalaladingdong,176,38,Feedback Wanted! ,False,False
1nout3g,2025-09-23T22:01:20+00:00,fashion,OOTD my fav outfit again srry!,bshxhdhe,99,6,Outfit of The Day,False,False
1noszc7,2025-09-23T20:49:13+00:00,fashion,Tried a traditional look today 💜 Thoughts?,Mai-nahitoh-kaunbey,93,36,Special Occasion Outfit,False,False
